{
  "$schema": "schemas/workboard-capabilities.schema.json",
  "manifest_schema_version": 1,
  "protocol_version": "1.2.0",
  "compatibility": {
    "classification": "backward-compatible",
    "minimum_reader_schema_version": 1,
    "unknown_capability_policy": "ignore"
  },
  "starter_sync": {
    "release": "ST-019",
    "commit": null,
    "source_reference": "https://github.com/2xgrowthagency/workboard-starter/issues/47",
    "adoption_record": "docs/releases/st-019-linear-trust-boundaries.md"
  },
  "capabilities": {
    "queue_classifier": {
      "status": "supported",
      "version": "1.0.0",
      "summary": "Queue-first local classification with bounded lane output and idle controls.",
      "evidence": {
        "files": [
          "scripts/check-workboard-queue.mjs",
          "docs/orchestrator-protocol.md"
        ],
        "tests": [
          "tests/check-workboard-queue.test.mjs"
        ]
      },
      "evidence_sha256": "ade03c31491ed80fb6d5b21f4d106b78d3ba39ce22dd1bbe4ec4d117fd6a509f"
    },
    "target_locks": {
      "status": "supported",
      "version": "1.0.0",
      "summary": "Exact project and path tuple locks across claimed builder and active QA work.",
      "evidence": {
        "files": [
          "scripts/check-workboard-target-lock.mjs",
          "docs/orchestrator-protocol.md"
        ],
        "tests": [
          "tests/check-workboard-target-lock.test.mjs",
          "tests/integrated-routing-lifecycle.test.mjs"
        ]
      },
      "evidence_sha256": "389862fb42902cd9ef2f102c72446db22952c59631e775ac950abde8de39c1ed"
    },
    "completion_callbacks": {
      "status": "supported",
      "version": "1.0.0",
      "summary": "One-shot canonical worker callbacks validated against packet, task, attempt, and lane.",
      "evidence": {
        "files": [
          "scripts/check-workboard-callback.mjs",
          "templates/task-packet.md"
        ],
        "tests": [
          "tests/check-workboard-callback.test.mjs",
          "tests/integrated-routing-lifecycle.test.mjs"
        ]
      },
      "evidence_sha256": "6085d781749a6ae10f4c8c73c186599f74e62866652ec05bf10085537d52274f"
    },
    "independent_qa": {
      "status": "supported",
      "version": "1.0.0",
      "summary": "Separate read-only QA tasks return PASS, FAIL, or BLOCKED against immutable evidence.",
      "evidence": {
        "files": [
          "ORCHESTRATOR.md",
          "templates/task-packet.md",
          "docs/orchestrator-protocol.md"
        ],
        "tests": [
          "tests/live-task-visibility-docs.test.mjs",
          "tests/integrated-routing-lifecycle.test.mjs"
        ]
      },
      "evidence_sha256": "821da9d02748a9471c5a9f3e312401b4a1157b19ff81ab293a45b1765f38a52d"
    },
    "qa_publication": {
      "status": "supported",
      "version": "1.0.0",
      "summary": "Policy-controlled GitHub QA verdict publication and informational worker notification.",
      "evidence": {
        "files": [
          "ORCHESTRATOR.md",
          "templates/task-packet.md",
          "docs/orchestrator-protocol.md"
        ],
        "tests": [
          "tests/live-task-visibility-docs.test.mjs"
        ]
      },
      "evidence_sha256": "1593f191ed8f542fd77af95afd337b24e56a4e7d66d360e9b7d5b63013d77cdc"
    },
    "dependency_promotion": {
      "status": "supported",
      "version": "1.0.0",
      "summary": "Root-owned dependency scanning with auto, review, manual, and blocked promotion policies.",
      "evidence": {
        "files": [
          "scripts/check-workboard-promotions.mjs",
          "docs/dependency-promotion.md"
        ],
        "tests": [
          "tests/check-workboard-promotions.test.mjs",
          "tests/dependency-promotion-docs.test.mjs"
        ]
      },
      "evidence_sha256": "283502b9c52929d8bc46a1fd858669d95ec58f3a55d2382ecf693250ae687998"
    },
    "task_finalization_hygiene": {
      "status": "supported",
      "version": "1.0.0",
      "summary": "Conservative Codex task finalization classifies bounded candidates for verified app-native hygiene.",
      "evidence": {
        "files": [
          "scripts/classify-codex-task-finalizer.mjs",
          "docs/codex-task-finalization.md"
        ],
        "tests": [
          "tests/codex-task-finalizer.test.mjs",
          "tests/codex-task-finalization-docs.test.mjs"
        ]
      },
      "evidence_sha256": "e4737e7676b654baf77b294f9f4977cde785b3ca14276a703a8de830981f58d5"
    },
    "app_native_codex_routing": {
      "status": "supported",
      "version": "1.0.0",
      "summary": "Codex Desktop routing requires app-native create, list, and readback visibility proof.",
      "evidence": {
        "files": [
          "docs/live-task-visibility.md",
          "scripts/check-task-creation-recovery.mjs"
        ],
        "tests": [
          "tests/live-task-visibility-docs.test.mjs",
          "tests/task-creation-recovery.test.mjs"
        ]
      },
      "evidence_sha256": "1aa6ada5bbad89bf19be3ec57c1901887acf1f385ef93fecfe75e3f45d2c9604"
    },
    "model_routing": {
      "status": "supported",
      "version": "1.0.0",
      "summary": "Packet, project, and portable model routes enforce escalation and verification policy.",
      "evidence": {
        "files": [
          "scripts/check-model-routing.mjs",
          "ORCHESTRATOR.md"
        ],
        "tests": [
          "tests/model-routing.test.mjs"
        ]
      },
      "evidence_sha256": "005d0975e086dfc3524378b89f9a0ce6a2f717ec36e56bc791e7c2301898e189"
    },
    "git_preflight": {
      "status": "supported",
      "version": "1.0.0",
      "summary": "Root Git synchronization preflight fails closed on unsafe state, identity, and lock conditions.",
      "evidence": {
        "files": [
          "scripts/check-workboard-git-preflight.mjs",
          "docs/orchestrator-protocol.md"
        ],
        "tests": [
          "tests/check-workboard-git-preflight.test.mjs",
          "tests/git-preflight-docs.test.mjs"
        ]
      },
      "evidence_sha256": "aa7df1143d3b72f11870c08ba8776d93e5b13ccb1010aabaa777ec1b0b70314f"
    },
    "known_issues_recovery": {
      "status": "supported",
      "version": "1.0.0",
      "summary": "Portable symptom, impact, stop, evidence, and recovery records cover known failures.",
      "evidence": {
        "files": [
          "docs/known-issues-and-recovery.md"
        ],
        "tests": [
          "tests/known-issues-recovery-docs.test.mjs"
        ]
      },
      "evidence_sha256": "fb9d3842f0b5f9957b3512027037a358762a17f1760e6bab5027780116db1739"
    },
    "closeout_links": {
      "status": "supported",
      "version": "1.0.0",
      "summary": "State-first root closeout verifies titles and exact same-ID created task links.",
      "evidence": {
        "files": [
          "scripts/check-workboard-closeout.mjs",
          "scripts/task-link.mjs",
          "docs/live-task-visibility.md"
        ],
        "tests": [
          "tests/workboard-closeout.test.mjs",
          "tests/live-task-visibility-docs.test.mjs"
        ]
      },
      "evidence_sha256": "8069f45d3d4d8657bbfa651cb45b49bbdc3ac08a022b1de72f348f29578cc5b7"
    },
    "task_packet_schema": {
      "status": "supported",
      "version": "2.1.0",
      "summary": "Strict packet schema validation includes explicit Local-versus-Worktree intent and resolution.",
      "evidence": {
        "files": [
          "scripts/check-task-packet.mjs",
          "docs/task-packet-schema.md",
          "templates/task-packet.md"
        ],
        "tests": [
          "tests/check-task-packet.test.mjs"
        ]
      },
      "evidence_sha256": "a77f092e3ca706a81e7e68913cca83854a364c258157a85a69286fa36e005a1f"
    },
    "execution_environment_routing": {
      "status": "supported",
      "version": "1.0.0",
      "summary": "Packet intent, project defaults, canonical reuse, and app-native proof resolve Local or Worktree execution.",
      "evidence": {
        "files": [
          "docs/orchestrator-protocol.md",
          "skills/workboard-orchestrator/SKILL.md",
          "templates/task-packet.md",
          "projects.example.yaml"
        ],
        "tests": [
          "tests/execution-environment-routing.test.mjs",
          "tests/check-task-packet.test.mjs"
        ]
      },
      "evidence_sha256": "54024e2f21ef057e5b8527e5a989f1ebb4d16c4820e02c23250c99d4f427e9cf"
    },
    "task_execution_profile": {
      "status": "supported",
      "version": "1.0.0",
      "summary": "Model, execution-environment, cloud-readiness, and single-writer state metadata form one task profile.",
      "evidence": {
        "files": [
          "scripts/check-task-execution-profile.mjs",
          "scripts/check-task-packet.mjs",
          "templates/task-packet.md",
          "docs/task-packet-schema.md"
        ],
        "tests": [
          "tests/task-execution-profile.test.mjs",
          "tests/check-task-packet.test.mjs"
        ]
      },
      "evidence_sha256": "695b153f8abf96c4b8426e832f14fb1475b309f9d26ed81a59aeaeff4437467f"
    },
    "linear_single_writer_engine": {
      "status": "supported",
      "version": "1.0.0",
      "summary": "Portable Linear transaction engine enforces identity, recovery, locks, canonical starts, callback provenance, and independent QA.",
      "evidence": {
        "files": [
          "scripts/linear-single-writer.mjs",
          "docs/linear-single-writer.md",
          "docs/orchestrator-protocol.md"
        ],
        "tests": [
          "tests/linear-single-writer.test.mjs"
        ]
      },
      "evidence_sha256": "ddfc45f77f8255caac8a5ceddbb04f56a9ab56340cdeb75f2ab216909a3c8873"
    },
    "linear_single_writer": {
      "status": "not_implemented",
      "version": null,
      "summary": "A concrete authenticated Linear and Codex adapter must be installed and certified by each adopting runtime.",
      "evidence": {
        "files": [